{
  "id": "example.mountain-camp",
  "version": "1.0.0",
  "exports": [
    "visit"
  ],
  "graphs": {
    "visit": {
      "title": {
        "provider": "local",
        "key": "camp.visit:title"
      },
      "parameters": {
        "visitor": "ref"
      },
      "locals": {
        "greetings": 0
      },
      "shared": {
        "letter": "bool",
        "rations": "int",
        "rests": "int"
      },
      "imports": {},
      "outcomes": [
        "left",
        "rested"
      ],
      "entry": "greet",
      "nodes": {
        "fire": {
          "id": "node:01a1095c2e437e0b8af31a3db12e31bc",
          "type_id": "narrata.passage",
          "data": {
            "args": {
              "greetings": {
                "kind": "read",
                "name": "greetings",
                "scope": "local"
              },
              "rations": {
                "kind": "read",
                "name": "rations",
                "scope": "shared"
              },
              "rests": {
                "kind": "read",
                "name": "rests",
                "scope": "shared"
              },
              "visitor": {
                "kind": "read",
                "name": "visitor",
                "scope": "parameter"
              }
            },
            "body": {
              "unit": {
                "key": "camp.fire",
                "provider": "local"
              }
            },
            "choice_points": [
              {
                "id": "choice-point:01a1095c2e437906a3ba76615e3fb798",
                "key": "choice",
                "options": [
                  {
                    "effects": [
                      {
                        "target": {
                          "name": "letter",
                          "scope": "shared"
                        },
                        "value": {
                          "kind": "literal",
                          "value": true
                        }
                      }
                    ],
                    "id": "option:01a1095c2e437c3db0ff5007061fc7c1",
                    "key": "letter",
                    "label": {
                      "key": "camp.visit:fire.letter.label",
                      "provider": "local"
                    },
                    "outcome": {
                      "kind": "branch",
                      "target": "letter"
                    },
                    "visible_if": {
                      "kind": "not",
                      "value": {
                        "kind": "read",
                        "name": "letter",
                        "scope": "shared"
                      }
                    }
                  },
                  {
                    "effects": [
                      {
                        "target": {
                          "name": "rations",
                          "scope": "shared"
                        },
                        "value": {
                          "kind": "binary",
                          "left": {
                            "kind": "read",
                            "name": "rations",
                            "scope": "shared"
                          },
                          "op": "sub",
                          "right": {
                            "kind": "literal",
                            "value": 1
                          }
                        }
                      },
                      {
                        "target": {
                          "name": "rests",
                          "scope": "shared"
                        },
                        "value": {
                          "kind": "binary",
                          "left": {
                            "kind": "read",
                            "name": "rests",
                            "scope": "shared"
                          },
                          "op": "add",
                          "right": {
                            "kind": "literal",
                            "value": 1
                          }
                        }
                      }
                    ],
                    "enabled_if": {
                      "kind": "binary",
                      "left": {
                        "kind": "read",
                        "name": "rations",
                        "scope": "shared"
                      },
                      "op": "gt",
                      "right": {
                        "kind": "literal",
                        "value": 0
                      }
                    },
                    "id": "option:01a1095c2e437518aa2500bb3c34f80c",
                    "key": "rest",
                    "label": {
                      "key": "camp.visit:fire.rest.label",
                      "provider": "local"
                    },
                    "outcome": {
                      "kind": "branch",
                      "target": "rest"
                    },
                    "reason": {
                      "key": "camp.visit:fire.rest.reason",
                      "provider": "local"
                    }
                  },
                  {
                    "id": "option:01a1095c2e437b90a32461379f3ccdda",
                    "key": "leave",
                    "label": {
                      "key": "camp.visit:fire.leave.label",
                      "provider": "local"
                    },
                    "outcome": {
                      "kind": "branch",
                      "target": "left"
                    }
                  }
                ]
              }
            ],
            "title": {
              "key": "camp.fire.title",
              "provider": "local"
            }
          }
        },
        "greet": {
          "id": "node:01a1095c2e4376e19bd2f11b94bc9329",
          "type_id": "narrata.mutate",
          "data": {
            "assignments": [
              {
                "target": {
                  "name": "greetings",
                  "scope": "local"
                },
                "value": {
                  "kind": "binary",
                  "left": {
                    "kind": "read",
                    "name": "greetings",
                    "scope": "local"
                  },
                  "op": "add",
                  "right": {
                    "kind": "literal",
                    "value": 1
                  }
                }
              }
            ],
            "next": "fire"
          }
        },
        "left": {
          "id": "node:01a1095c2e437bbe963d941a568b0ee3",
          "type_id": "narrata.return",
          "data": {
            "outcome": "left"
          }
        },
        "letter": {
          "id": "node:01a1095c2e437ef2b3a496c12a47d840",
          "type_id": "narrata.passage",
          "data": {
            "body": {
              "unit": {
                "key": "camp.letter",
                "provider": "local"
              }
            },
            "choice_points": [
              {
                "id": "choice-point:01a1095c2e43715b9ced15ec2498f4cc",
                "key": "choice",
                "options": [
                  {
                    "id": "option:01a1095c2e437892be733513159087c4",
                    "key": "continue",
                    "label": {
                      "key": "camp.visit:letter.continue.label",
                      "provider": "local"
                    },
                    "outcome": {
                      "kind": "branch",
                      "target": "fire"
                    }
                  }
                ]
              }
            ],
            "title": {
              "key": "camp.letter.title",
              "provider": "local"
            }
          }
        },
        "rest": {
          "id": "node:01a1095c2e437b029d160d108c77f7ee",
          "type_id": "narrata.passage",
          "data": {
            "body": {
              "unit": {
                "key": "camp.rest",
                "provider": "local"
              }
            },
            "choice_points": [
              {
                "id": "choice-point:01a1095c2e437452883ff98911ddbf7a",
                "key": "choice",
                "options": [
                  {
                    "id": "option:01a1095c2e43777699cd5d89668ddff7",
                    "key": "continue",
                    "label": {
                      "key": "camp.visit:rest.continue.label",
                      "provider": "local"
                    },
                    "outcome": {
                      "kind": "branch",
                      "target": "rested"
                    }
                  }
                ]
              }
            ],
            "title": {
              "key": "camp.rest.title",
              "provider": "local"
            }
          }
        },
        "rested": {
          "id": "node:01a1095c2e437543b09e3946372eef5d",
          "type_id": "narrata.return",
          "data": {
            "outcome": "rested"
          }
        }
      }
    }
  }
}
