{"exports":["journey"],"graphs":{"journey":{"entry":"station","imports":{"camp":{"outcomes":["left","rested"],"parameters":{"visitor":"ref"}},"road":{"outcomes":["crossed","retreated"],"parameters":{}}},"locals":{},"nodes":{"arrived":{"data":{"outcome":"arrived"},"id":"node:01a1095c2e4377c3b19d2d0379951e5b","type_id":"narrata.return"},"camp":{"data":{"arguments":{"visitor":{"kind":"literal","value":{"key":"main:visitor","provider":"local"}}},"on_return":{"left":"station","rested":"station"},"target":{"kind":"import","port":"camp"}},"id":"node:01a1095c2e43745d8de74c7a20d4e25d","type_id":"narrata.call"},"delivered":{"data":{"outcome":"delivered"},"id":"node:01a1095c2e437cc1bdfa2c6bbc6e529b","type_id":"narrata.return"},"gate":{"data":{"body":{"unit":{"key":"main.gate","provider":"local"}},"choice_points":[{"id":"choice-point:01a1095c2e437534b3686842af8acea9","key":"choice","options":[{"enabled_if":{"kind":"read","name":"letter","scope":"shared"},"id":"option:01a1095c2e437cca8b23d4c1136f5320","key":"deliver","label":{"key":"main.journey:gate.deliver.label","provider":"local"},"outcome":{"kind":"branch","target":"delivered"},"reason":{"key":"main.journey:gate.deliver.reason","provider":"local"}},{"id":"option:01a1095c2e437cf08e1cb78d7079c72e","key":"arrive","label":{"key":"main.journey:gate.arrive.label","provider":"local"},"outcome":{"kind":"branch","target":"arrived"}}]}],"title":{"key":"main.gate.title","provider":"local"}},"id":"node:01a1095c2e437f11bd35937bb860612d","type_id":"narrata.passage"},"ledger":{"data":{"body":{"unit":{"key":"main.ledger","provider":"local"}},"choice_points":[{"id":"choice-point:01a1095ca7f87aa7a387d3c959c6e96e","key":"sign","options":[{"effects":[{"target":{"name":"signed","scope":"shared"},"value":{"kind":"literal","value":true}}],"id":"option:01a1095ca7f87d65a8958b6ba93b3ba1","key":"sign","label":{"key":"main.journey:ledger.sign.label","provider":"local"},"outcome":{"kind":"local","rejoin":"l2","reply":{"first":"l-sign","last":"l-sign","unit":{"key":"main.ledger","provider":"local"}}}},{"id":"option:01a1095ca7f87d4eafbbcb129273afd8","key":"skip","label":{"key":"main.journey:ledger.skip.label","provider":"local"},"outcome":{"kind":"local","rejoin":"l2","reply":{"first":"l-skip","last":"l-skip","unit":{"key":"main.ledger","provider":"local"}}}}],"placement":"l1"},{"id":"choice-point:01a1095ca7f87ce1ab13598a2cb657a7","key":"supplies","max":2,"min":0,"options":[{"effects":[{"target":{"name":"packed","scope":"shared"},"value":{"kind":"binary","left":{"kind":"read","name":"packed","scope":"shared"},"op":"add","right":{"kind":"literal","value":1}}}],"id":"option:01a1095ca7f87e90852f47c85a110ef3","key":"candle","label":{"key":"main.journey:ledger.candle.label","provider":"local"},"outcome":{"kind":"local","rejoin":"l3","reply":{"first":"l-candle","last":"l-candle","unit":{"key":"main.ledger","provider":"local"}}}},{"effects":[{"target":{"name":"packed","scope":"shared"},"value":{"kind":"binary","left":{"kind":"read","name":"packed","scope":"shared"},"op":"add","right":{"kind":"literal","value":1}}}],"id":"option:01a1095ca7f87512ae94f6455a76a5cf","key":"rope","label":{"key":"main.journey:ledger.rope.label","provider":"local"},"outcome":{"kind":"local","rejoin":"l3","reply":{"first":"l-rope","last":"l-rope","unit":{"key":"main.ledger","provider":"local"}}}},{"effects":[{"target":{"name":"packed","scope":"shared"},"value":{"kind":"binary","left":{"kind":"read","name":"packed","scope":"shared"},"op":"add","right":{"kind":"literal","value":1}}}],"id":"option:01a1095ca7f87e5bb75f127d66d356d6","key":"flask","label":{"key":"main.journey:ledger.flask.label","provider":"local"},"outcome":{"kind":"local","rejoin":"l3","reply":{"first":"l-flask","last":"l-flask","unit":{"key":"main.ledger","provider":"local"}}}}],"placement":"l2"}],"next":"station","title":{"key":"main.ledger.title","provider":"local"}},"id":"node:01a1095ca7f87b788bdafb59c9031889","type_id":"narrata.passage"},"road":{"data":{"arguments":{},"on_return":{"crossed":"gate","retreated":"station"},"target":{"kind":"import","port":"road"}},"id":"node:01a1095c2e437cb3adf31442154f39a4","type_id":"narrata.call"},"station":{"data":{"body":{"unit":{"key":"main.station","provider":"local"}},"choice_points":[{"id":"choice-point:01a1095c2e437ba59dd48fd4be0bbc61","key":"choice","options":[{"id":"option:01a1095c2e437b698f7e154622c82f1b","key":"road","label":{"key":"main.journey:station.road.label","provider":"local"},"outcome":{"kind":"branch","target":"road"}},{"id":"option:01a1095c2e4375988aec51f5571f73fe","key":"camp","label":{"key":"main.journey:station.camp.label","provider":"local"},"outcome":{"kind":"branch","target":"camp"}},{"id":"option:01a1095ca7f87a59aeee8f82408d92ce","key":"ledger","label":{"key":"main.journey:station.ledger.label","provider":"local"},"outcome":{"kind":"branch","target":"ledger"},"visible_if":{"kind":"binary","left":{"kind":"not","value":{"kind":"read","name":"signed","scope":"shared"}},"op":"and","right":{"kind":"binary","left":{"kind":"read","name":"packed","scope":"shared"},"op":"eq","right":{"kind":"literal","value":0}}}}]}],"title":{"key":"main.station.title","provider":"local"}},"id":"node:01a1095c2e437b9e9de51d9d951a1e2c","type_id":"narrata.passage"}},"outcomes":["arrived","delivered"],"parameters":{},"shared":{"helped":"bool","letter":"bool","packed":"int","rations":"int","rests":"int","signed":"bool"},"title":{"key":"main.journey:title","provider":"local"}}},"id":"example.mountain-main","version":"1.0.0"}