{
  "id": "example.mountain-road",
  "version": "1.0.0",
  "exports": [
    "crossing"
  ],
  "graphs": {
    "crossing": {
      "title": {
        "provider": "local",
        "key": "road.crossing:title"
      },
      "parameters": {},
      "locals": {},
      "shared": {
        "helped": "bool",
        "rations": "int"
      },
      "imports": {},
      "outcomes": [
        "crossed",
        "retreated"
      ],
      "entry": "rocks",
      "nodes": {
        "crossed": {
          "id": "node:01a1095c2e43771ca52d99cc33516245",
          "type_id": "narrata.return",
          "data": {
            "outcome": "crossed"
          }
        },
        "fog": {
          "id": "node:01a1095c2e43797a9c29a5f3850c689a",
          "type_id": "narrata.passage",
          "data": {
            "body": {
              "unit": {
                "key": "road.fog",
                "provider": "local"
              }
            },
            "choice_points": [
              {
                "id": "choice-point:01a1095c2e437b4289168f4c509d77b4",
                "key": "choice",
                "options": [
                  {
                    "id": "option:01a1095c2e43782881da3c01eba2167b",
                    "key": "continue",
                    "label": {
                      "key": "road.crossing:fog.continue.label",
                      "provider": "local"
                    },
                    "outcome": {
                      "kind": "branch",
                      "target": "crossed"
                    }
                  }
                ]
              }
            ],
            "title": {
              "key": "road.fog.title",
              "provider": "local"
            }
          }
        },
        "retreated": {
          "id": "node:01a1095c2e437bafaa84365ad08aafa1",
          "type_id": "narrata.return",
          "data": {
            "outcome": "retreated"
          }
        },
        "rocks": {
          "id": "node:01a1095c2e43768780152bc61c64951c",
          "type_id": "narrata.passage",
          "data": {
            "body": {
              "unit": {
                "key": "road.rocks",
                "provider": "local"
              }
            },
            "choice_points": [
              {
                "id": "choice-point:01a1095c2e437fc595b9d4c165c4af01",
                "key": "choice",
                "options": [
                  {
                    "effects": [
                      {
                        "target": {
                          "name": "rations",
                          "scope": "shared"
                        },
                        "value": {
                          "kind": "binary",
                          "left": {
                            "kind": "read",
                            "name": "rations",
                            "scope": "shared"
                          },
                          "op": "sub",
                          "right": {
                            "kind": "literal",
                            "value": 1
                          }
                        }
                      },
                      {
                        "target": {
                          "name": "helped",
                          "scope": "shared"
                        },
                        "value": {
                          "kind": "literal",
                          "value": true
                        }
                      }
                    ],
                    "enabled_if": {
                      "kind": "binary",
                      "left": {
                        "kind": "read",
                        "name": "rations",
                        "scope": "shared"
                      },
                      "op": "gt",
                      "right": {
                        "kind": "literal",
                        "value": 0
                      }
                    },
                    "id": "option:01a1095c2e437857b3e9ac28126d1ee3",
                    "key": "help",
                    "label": {
                      "key": "road.crossing:rocks.help.label",
                      "provider": "local"
                    },
                    "outcome": {
                      "kind": "branch",
                      "target": "trail"
                    },
                    "reason": {
                      "key": "road.crossing:rocks.help.reason",
                      "provider": "local"
                    }
                  },
                  {
                    "id": "option:01a1095c2e43709691c1c1d20b10e418",
                    "key": "alone",
                    "label": {
                      "key": "road.crossing:rocks.alone.label",
                      "provider": "local"
                    },
                    "outcome": {
                      "kind": "branch",
                      "target": "fog"
                    }
                  },
                  {
                    "id": "option:01a1095c2e437fe0a836b4d701d35f87",
                    "key": "retreat",
                    "label": {
                      "key": "road.crossing:rocks.retreat.label",
                      "provider": "local"
                    },
                    "outcome": {
                      "kind": "branch",
                      "target": "retreated"
                    }
                  }
                ]
              }
            ],
            "title": {
              "key": "road.rocks.title",
              "provider": "local"
            }
          }
        },
        "trail": {
          "id": "node:01a1095c2e4371e4a87f44627bda7b31",
          "type_id": "narrata.passage",
          "data": {
            "body": {
              "unit": {
                "key": "road.trail",
                "provider": "local"
              }
            },
            "choice_points": [
              {
                "id": "choice-point:01a1095c2e437f8eb2c688500318ba37",
                "key": "choice",
                "options": [
                  {
                    "id": "option:01a1095c2e437d08a0c2047ce499b754",
                    "key": "continue",
                    "label": {
                      "key": "road.crossing:trail.continue.label",
                      "provider": "local"
                    },
                    "outcome": {
                      "kind": "branch",
                      "target": "crossed"
                    }
                  }
                ]
              }
            ],
            "title": {
              "key": "road.trail.title",
              "provider": "local"
            }
          }
        }
      }
    }
  }
}
